#node	identifier	domain_summary_url	annotation	other_names_and_aliases
Actl6a	10090.ENSMUSP00000029214	Actin-like protein 6A; Involved in transcriptional activation and repression of select genes by chromatin remodeling (alteration of DNA-nucleosome topology). Component of SWI/SNF chromatin remodeling complexes that carry out key enzymatic activities, changing chromatin structure by altering DNA-histone contacts within a nucleosome in an ATP-dependent manner. Required for maximal ATPase activity of SMARCA4/BRG1/BAF190A and for association of the SMARCA4/BRG1/BAF190A containing remodeling complex BAF with chromatin/nuclear matrix. Belongs to the neural progenitors- specific chromatin rem [...] 	https://smart.embl.de/smart/DDvec.cgi?smart=429:ACTIN(11|429)+	2810432C06Rik,53 kDa BRG1-associated factor A,56456,AAC94992.1,AAH01994.1,AAH94498.1,AC116736,ACL6A_MOUSE,ACTL6A,AF041476,AI851094,AK090154,AK167905,ARP4,Actin-like 6A,Actin-like protein 6A,Actin-related protein Baf53a,Actl6,Actl6a,Actl6a-001,Actl6a-002,Actl6a-003,Actl6a-004,BAC41116.1,BAE39913.1,BAF53A,BC001994,BC094498,BRG1-associated factor 53A,Baf53a,C79802,CCDS17298.1,D3YVN1,EDL35006.1,ENSMUSG00000027671,ENSMUSP00000029214,ENSMUSP00000114317,ENSMUST00000029214,ENSMUST00000126144,ENSMUST00000135400,ENSMUST00000153779,G630007K23,I730036H16,MGI:1861453,Mm.41077,NM_019673,NM_019673.2,NP_062647,NP_062647.2,OTTMUSG00000021872,OTTMUSP00000024516,OTTMUSP00000024517,OTTMUST00000051921,OTTMUST00000051922,OTTMUST00000051923,OTTMUST00000051924,Q505L1,Q8C1W3,Q99M56,Q9Z2N8,UPI0000022C84,UPI0000F2224E,XP_006535566,XP_006535566.1,actin-like 6A,mmu:56456,uc012coo.1
Actl6b	10090.ENSMUSP00000119356	Actin-like protein 6B; Involved in transcriptional activation and repression of select genes by chromatin remodeling (alteration of DNA-nucleosome topology). Component of SWI/SNF chromatin remodeling complexes that carry out key enzymatic activities, changing chromatin structure by altering DNA-histone contacts within a nucleosome in an ATP-dependent manner. Belongs to the neuron-specific chromatin remodeling complex (nBAF complex), as such plays a role in remodeling mononucleosomes in an ATP-dependent fashion, and is required for postmitotic neural development and dendritic outgrowth. [...] 	https://smart.embl.de/smart/DDvec.cgi?smart=426:ACTIN(11|426)+	53 kDa BRG1-associated factor B,83766,AAH49539.1,AAK28829.1,AB075226,ACL6B_MOUSE,ACTL6B,Actin-like 6B,Actin-like protein 6B,Actin-related protein Baf53b,Actl6,Actl6b,Actl6b-001,Actl6b-002,Actl6b-003,Actl6b-004,Actl6b-005,Actl6b-006,Actl6b-007,ArpN-alpha,ArpNa,Arpna,BAB97312.1,BAF53B,BC049539,BRG1-associated factor 53B,Baf53b,CCDS19770.1,D3Z2E2,D3Z4L2,D3Z5W4,EDL19262.1,ENSMUSG00000029712,ENSMUSP00000031725,ENSMUSP00000117138,ENSMUSP00000117425,ENSMUSP00000119356,ENSMUSP00000121672,ENSMUSP00000123004,ENSMUST00000031725,ENSMUST00000125489,ENSMUST00000136088,ENSMUST00000136565,ENSMUST00000139395,ENSMUST00000145500,ENSMUST00000149292,F8WI57,MGI:1933548,NM_031404,NM_031404.4,NP_113581,NP_113581.1,OTTMUSG00000021924,OTTMUSP00000024596,OTTMUSP00000024597,OTTMUSP00000024598,OTTMUSP00000024599,OTTMUSP00000024600,OTTMUSP00000038899,OTTMUST00000052049,OTTMUST00000052050,OTTMUST00000052051,OTTMUST00000052052,OTTMUST00000052053,OTTMUST00000052054,OTTMUST00000052055,Q54A88,Q99MR0,UPI0000001E7D,UPI0000F2229C,UPI0000F2229D,UPI0000F2229E,UPI0000F2229F,UPI000164C460,XP_006504698,XP_006504698.1,XP_006504699,XP_006504699.1,XP_006504700,XP_006504700.1,XP_006504701,XP_006504701.1,actin-like 6B,mmu:83766,uc009acu.1
Arid4a	10090.ENSMUSP00000035512	At-rich interactive domain-containing protein 4a; AT rich interactive domain 4A (RBP1-like)	https://smart.embl.de/smart/DDvec.cgi?smart=1261:TUDOR(58|114)+Pfam_RBB1NT(170|262)+BRIGHT(310|402)+CHROMO(483|652)+COIL(1185|1224)+	238247,A630009N03,A630067N03,A630067N03Rik,AAN47197.1,AAN84615.1,AAN84616.1,AAN84617.1,AC112794,AK041444,AK042186,AK050594,ARI4A_MOUSE,ARID domain-containing protein 4A,ARID4A,AT rich interactive domain 4A (RBP1-like),AT-rich interactive domain 4A (RBP1-like),AT-rich interactive domain-containing protein 4A,AY116675,AY163235,AY163236,AY163237,Arid4a,Arid4a-001,Arid4a-002,Arid4a-003,Arid4a-004,B2RXT8,B2RY61,BAC30948.1,BAC31192.1,BAC34332.1,C920008O22,CCDS36471.1,E9Q9V1,ENSMUSG00000048118,ENSMUSP00000035512,ENSMUSP00000052271,ENSMUSP00000080874,ENSMUSP00000121109,ENSMUSP00000121319,ENSMUST00000046305,ENSMUST00000058026,ENSMUST00000082246,ENSMUST00000125125,ENSMUST00000134718,ENSMUST00000135709,F8VPQ2,F8VPQ2_MOUSE,MGI:2444354,Mm.241601,Mm.471809,MmRBBP1,NM_001081195,NM_001081195.1,NP_001074664,NP_001074664.1,OTTMUSG00000017260,OTTMUSP00000018775,OTTMUSP00000018776,OTTMUSP00000018777,OTTMUST00000041768,OTTMUST00000041769,OTTMUST00000041770,OTTMUST00000041771,Q05CI2,Q6PE90,Q8BWM4,Q8BY40,Q8BYA2,Q8CGM7,Q8CGM8,Q8CGM9,Q8CIT7,RBBP1,Rbbp1,Retinoblastoma-binding protein 1,UPI00000EA5BF,UPI0000429287,UPI0000DBECE9,XM_006515833,XM_017315057.1,XP_006515896,XP_006515896.1,XP_006515897,XP_006515897.1,XP_006515898,XP_006515898.1,XP_017170546.1,mmu:238247,uc007nud.1,uc007nue.1,uc007nuf.1,uc011ynm.1
Arid4b	10090.ENSMUSP00000106163	AT-rich interactive domain-containing protein 4B; Acts as a transcriptional repressor. May function in the assembly and/or enzymatic activity of the Sin3A corepressor complex or in mediating interactions between the complex and other regulatory complexes (By similarity)	https://smart.embl.de/smart/DDvec.cgi?smart=1314:TUDOR(58|114)+Pfam_RBB1NT(168|263)+ARID(303|394)+COIL(528|565)+CHROMO(585|640)+COIL(1232|1269)+	180 kDa Sin3-associated polypeptide,5930400I17,94246,A2CG61,A2CG62,A2CG63,A2CG64,A630005J11,A630008A11,A630065K04,AAI37784.1,AK031062,AK041366,AK041414,AK080355,ARI4B_MOUSE,ARID domain-containing protein 4B,ARID4B,AT rich interactive domain 4B (RBP1-like),AT-rich interactive domain-containing protein 4B,Arid4b,Arid4b-001,Arid4b-002,Arid4b-003,Arid4b-004,Arid4b-005,Arid4b-006,Arid4b-007,Arid4b-008,Arid4b-009,Arid4b-201,B2RQ67,BAC27233.1,BAC30920.1,BAC30936.1,BAC37887.1,BC137783,BCAA,BRCAA1,CAM21242.1,CAM21243.1,CAM21244.1,CAM21245.1,CCDS36599.1,CCDS36600.1,CT025604,ENSMUSG00000039219,ENSMUSP00000043889,ENSMUSP00000051387,ENSMUSP00000071447,ENSMUSP00000106162,ENSMUSP00000106163,ENSMUSP00000106165,ENSMUSP00000118687,ENSMUSP00000119147,ENSMUST00000039538,ENSMUST00000049601,ENSMUST00000071512,ENSMUST00000110533,ENSMUST00000110534,ENSMUST00000110536,ENSMUST00000129488,ENSMUST00000148941,ENSMUST00000149579,ENSMUST00000151151,ENSMUST00000151182,ENSMUST00000155553,Histone deacetylase complex subunit SAP180,MGI:2137512,Mm.436478,Mm.439784,Mm.450893,NM_194262,NM_194262.1,NM_194262.2,NM_198122,NM_198122.1,NM_198122.2,NP_919238,NP_919238.1,NP_937755,NP_937755.1,OTTMUSG00000018144,OTTMUSP00000018788,OTTMUSP00000018790,OTTMUSP00000018791,OTTMUSP00000018792,OTTMUSP00000018793,OTTMUST00000041785,OTTMUST00000041791,OTTMUST00000041792,OTTMUST00000041793,OTTMUST00000041794,OTTMUST00000041795,OTTMUST00000041806,OTTMUST00000041807,OTTMUST00000041808,Q8BMI8,Q8BV50,Q8BYA5,Q8BYB0,RBBP1L1,Rbp1l1,SAP180,Sap180,Sin3-associated polypeptide p180,UPI00001D8AD8,UPI00001D8AD9,UPI0000DBECF5,UPI0000DBECF6,UPI0000DBECF7,XM_006516806,XM_006516806.2,XM_006516807,XM_006516807.2,XM_017315648.1,XP_006516869,XP_006516869.1,XP_006516870,XP_006516870.1,XP_017171137.1,Z4YL44,Z4YMH1,mmu:94246,uc007pmy.2,uc007pmz.2,uc007pna.2,uc007pnb.1
Batf	10090.ENSMUSP00000040706	Basic leucine zipper transcriptional factor ATF-like; AP-1 family transcription factor that controls the differentiation of lineage-specific cells in the immune system: specifically mediates the differentiation of T-helper 17 cells (Th17), follicular T-helper cells (TfH), CD8(+) dendritic cells and class-switch recombination (CSR) in B-cells. Acts via the formation of a heterodimer with JUNB that recognizes and binds DNA sequence 5'-TGA[CG]TCA-3'. The BATF-JUNB heterodimer also forms a complex with IRF4 (or IRF8) in immune cells, leading to recognition of AICE sequence (5'-TGAnTCA/GAAA [...] 	https://smart.embl.de/smart/DDvec.cgi?smart=125:BRLZ(24|88)+	53314,9130003H19,A2RT86,AAB70251.1,AAI32411.1,AAI32413.1,AF017021,AK018587,B-ATF,B-cell-activating transcription factor,BAB31294.1,BATF,BATF_MOUSE,BC132410,BC132412,Batf,Batf-001,CCDS26061.1,ENSMUSG00000034266,ENSMUSP00000040706,ENSMUST00000040536,MGI:1859147,Mm.6672,NM_016767,NM_016767.2,NP_058047,NP_058047.1,O35284,OTTMUSG00000016692,OTTMUSP00000018061,OTTMUST00000040432,SFA-2,UPI0000024EA1,mmu:53314,uc007ohd.1
Bdnf	10090.ENSMUSP00000057989	Brain-derived neurotrophic factor; During development, promotes the survival and differentiation of selected neuronal populations of the peripheral and central nervous systems. Participates in axonal growth, pathfinding and in the modulation of dendritic growth and morphology. Major regulator of synaptic transmission and plasticity at adult synapses in many regions of the CNS	https://smart.embl.de/smart/DDvec.cgi?smart=257:SIGNAL(1|26)+NGF(143|250)+	12064,A2AII2,AAG47494.1,AAH34862.1,AAL27784.1,AAL27785.1,AAL27786.1,AAL27787.1,AAL27788.1,AAL27789.1,AAL27790.1,AAL27791.1,AAO74602.1,AAO74603.1,ABM30155.1,ABM30156.1,ABM30157.1,ABM30158.1,ABM30159.1,ABM30160.1,ABM30167.1,ABM30168.1,ABM30169.1,ABM30170.1,ABM30171.1,AGR50951.1,AL732477,AY011461,AY057907,AY057908,AY057909,AY057910,AY057911,AY057912,AY057913,AY057914,AY231131,AY231132,BC034862,BDNF,BDNF precursor form,BDNF_MOUSE,Bdnf,Bdnf-001,Bdnf-002,Bdnf-003,Bdnf-004,Bdnf-005,Bdnf-006,Bdnf-007,Bdnf-008,Bdnf-009,Bdnf-010,Bdnf-011,Brain derived neurotrophic factor,Brain-derived neurotrophic factor,CAA39159.1,CCDS38193.1,CCDS38194.1,EF125669,EF125670,EF125671,EF125672,EF125673,EF125674,EF125681,EF125682,EF125683,EF125684,EF125685,ENSMUSG00000048482,ENSMUSP00000057989,ENSMUSP00000087842,ENSMUSP00000087843,ENSMUSP00000106671,ENSMUSP00000106672,ENSMUSP00000106673,ENSMUSP00000106674,ENSMUSP00000106675,ENSMUSP00000106676,ENSMUSP00000106678,ENSMUSP00000106679,ENSMUSP00000106680,ENSMUSP00000106681,ENSMUSP00000135762,ENSMUST00000053317,ENSMUST00000090365,ENSMUST00000090366,ENSMUST00000111042,ENSMUST00000111043,ENSMUST00000111044,ENSMUST00000111045,ENSMUST00000111046,ENSMUST00000111047,ENSMUST00000111049,ENSMUST00000111050,ENSMUST00000111051,ENSMUST00000111052,ENSMUST00000176893,H9H9S8,KC855560,MGI:88145,Mm.1442,Mm.407946,Mm.407972,NM_001048139,NM_001048139.1,NM_001048141,NM_001048141.1,NM_001048142,NM_001048142.1,NM_001285416,NM_001285416.1,NM_001285417,NM_001285417.1,NM_001285418,NM_001285418.1,NM_001285419,NM_001285419.1,NM_001285420,NM_001285420.1,NM_001285421,NM_001285421.1,NM_001285422,NM_001285422.1,NM_001316310.1,NM_007540,NM_007540.4,NP_001041604,NP_001041604.1,NP_001041606,NP_001041606.1,NP_001041607,NP_001041607.1,NP_001272345,NP_001272345.1,NP_001272346,NP_001272346.1,NP_001272347,NP_001272347.1,NP_001272348,NP_001272348.1,NP_001272349,NP_001272349.1,NP_001272350,NP_001272350.1,NP_001272351,NP_001272351.1,NP_001303239.1,NP_031566,NP_031566.4,OTTMUSG00000015122,OTTMUSP00000016087,OTTMUSP00000016088,OTTMUSP00000016089,OTTMUSP00000016090,OTTMUSP00000016091,OTTMUSP00000016092,OTTMUSP00000016093,OTTMUSP00000016094,OTTMUSP00000016095,OTTMUSP00000056673,OTTMUSP00000056674,OTTMUST00000035862,OTTMUST00000035863,OTTMUST00000035864,OTTMUST00000035865,OTTMUST00000035866,OTTMUST00000035867,OTTMUST00000035868,OTTMUST00000035869,OTTMUST00000035870,OTTMUST00000101213,OTTMUST00000101214,P21237,ProBDNF,Q541P3,Q8CCH9,Q99NV8,S5MVY4,UPI000000112B,UPI0000D778B7,UPI0002467755,X55573,brain derived neurotrophic factor,mmu:12064,uc008lmd.1,uc008lme.1,uc008lmf.1,uc008lmg.1,uc008lmh.1,uc008lmi.1,uc008lmj.1,uc008lmk.1,uc008lml.1,uc008lmm.1
Bptf	10090.ENSMUSP00000102374	Bromodomain PHD finger transcription factor	https://smart.embl.de/smart/DDvec.cgi?smart=3036:DDT(252|312)+Pfam_WHIM1(356|394)+PHD(404|447)+Pfam_WSD(468|536)+COIL(989|1019)+COIL(2023|2051)+COIL(2604|2642)+COIL(2691|2719)+PHD(2859|2906)+BROMO(2915|3023)+	9430093H17Rik,A2A652,A2A653,A2A654,A2A654_MOUSE,A2A655,AAH60715.1,AK082852,AL596116,BAC38653.1,BC060715,BPTF,Bptf,Bptf-001,Bptf-002,Bptf-003,Bptf-004,Bptf-005,Bptf-006,Bptf-201,Bromodomain PHD finger transcription factor,C330043E15,CCDS48964.1,E9Q6A7,ENSMUSG00000040481,ENSMUSP00000042085,ENSMUSP00000052303,ENSMUSP00000091445,ENSMUSP00000102373,ENSMUSP00000102374,ENSMUSP00000118875,ENSMUSP00000122575,ENSMUSP00000128258,ENSMUST00000041145,ENSMUST00000057892,ENSMUST00000093917,ENSMUST00000106762,ENSMUST00000106763,ENSMUST00000133317,ENSMUST00000138443,ENSMUST00000147816,ENSMUST00000149486,ENSMUST00000163676,Falz,MGI:2444008,Mm.343986,Mm.412605,NM_176850,NM_176850.2,NP_789820,NP_789820.2,OTTMUSG00000003587,OTTMUSP00000003750,OTTMUSP00000003799,OTTMUSP00000003800,OTTMUSP00000003801,OTTMUST00000007729,OTTMUST00000007829,OTTMUST00000007830,OTTMUST00000007831,OTTMUST00000007832,OTTMUST00000007833,Q6P9L3,Q8C473,UPI000059DD8D,UPI000059DD8E,UPI000059DD8F,UPI000059DD90,UPI0000F6E7CA,bromodomain PHD finger transcription factor,uc007mac.1
Brms1	10090.ENSMUSP00000112266	Breast cancer metastasis-suppressor 1 and related proteins; Breast cancer metastasis-suppressor 1 homolog; Transcriptional repressor. Down-regulates transcription activation by NF-kappa-B by promoting the deacetylation of RELA at 'Lys-310'. Promotes HDAC1 binding to promoter regions. Down- regulates expression of anti-apoptotic genes that are controlled by NF-kappa-B. Promotes apoptosis in cells that have inadequate adherence to a substrate, a process called anoikis, and may thereby inhibit metastasis (By similarity)	https://smart.embl.de/smart/DDvec.cgi?smart=246:Pfam_Sds3(60|211)+	107392,AAH16108.1,AAK15007.1,AAK51553.1,AAL76070.1,AAL76071.1,AAL76072.1,AAL76073.1,AAL76075.1,AAL76076.1,AF233580,AF368292,AF467879,AF467880,AF467881,AF467882,AF467884,AF467885,AV003220,AW554636,BC016108,BRMS1,BRMS1_MOUSE,Breast cancer metastasis-suppressor 1,Breast cancer metastasis-suppressor 1 homolog,Brms1,Brms1-201,CCDS50355.1,EDL33091.1,EDL33093.1,ENSMUSG00000080268,ENSMUSP00000112266,ENSMUSP00000126906,ENSMUST00000116567,ENSMUST00000167503,MGI:2388804,NM_134155,NM_134155.1,NP_598916,NP_598916.1,Q547N0,Q99N20,UPI0000000F34,XM_006531623,XM_006531623.1,XP_006531686,XP_006531686.1,breast cancer metastasis-suppressor 1,mmu:107392,uc008gbz.1
Btrc	10090.ENSMUSP00000070728	F-box/WD repeat-containing protein 1A; Substrate recognition component of a SCF (SKP1-CUL1-F- box protein) E3 ubiquitin-protein ligase complex which mediates the ubiquitination and subsequent proteasomal degradation of target proteins. Recognizes and binds to phosphorylated target proteins. SCF(BTRC) mediates the ubiquitination of CTNNB1 and participates in Wnt signaling. SCF(BTRC) mediates the ubiquitination of NFKBIA, NFKBIB and NFKBIE; the degradation frees the associated NFKB1 to translocate into the nucleus and to activate transcription. Ubiquitination of NFKBIA occurs at 'Lys- 21 [...] 	https://smart.embl.de/smart/DDvec.cgi?smart=605:Beta-TrCP_D(138|177)+FBOX(189|228)+WD40(292|329)+WD40(332|369)+WD40(372|409)+WD40(415|452)+WD40(455|492)+WD40(495|532)+WD40(544|581)+	12234,AAD04181.1,AAD08701.1,AAD17755.1,AAD41025.1,AAH03989.1,AAL40929.1,AF081887,AF099932,AF110396,AF112979,AF391178,AF391179,AF391180,AF391181,AF391182,AF391183,AF391184,AF391185,AF391186,AF391187,AF391188,AF391189,AF391190,AK145624,AK156660,AK220183,BAD90368.1,BAE26547.1,BAE33798.1,BC003989,BTRC,Beta-TrCP,Beta-TrCP protein E3RS-IkappaB,Beta-Trcp1,Beta-transducin repeat containing protein,Beta-transducin repeat-containing protein,Btrc,Btrc-201,Btrc-202,CCDS29860.1,CCDS38002.1,E3RS-IkappaB,E3RSIkappaB,EDL41951.1,ENSMUSG00000025217,ENSMUSP00000070728,ENSMUSP00000084246,ENSMUSP00000107567,ENSMUSP00000107571,ENSMUST00000065601,ENSMUST00000087021,ENSMUST00000111936,ENSMUST00000111940,F-box and WD repeats protein beta-TrCP,F-box and WD-40 domain protein 1/11,F-box/WD repeat-containing protein 1A,F830035N03,FBW1A_MOUSE,FWD1,Fbw1,Fbw1a,Fbxw1,Fwd1,HOS,I1C0023J12,Kiaa4123,MGI:1338871,Mm.119717,NM_001037758,NM_001037758.2,NM_001286465,NM_001286465.1,NM_001286466,NM_001286466.1,NM_009771,NM_009771.3,NP_001032847,NP_001032847.2,NP_001273394,NP_001273394.1,NP_001273395,NP_001273395.1,NP_033901,NP_033901.1,Q3U0Q4,Q3ULA2,Q571K6,Q9QUI5,Q9R1G7,Q9Z159,SCF b-TRCP,SCF_b-TRCP,Slimb,UPI00000298CD,UPI00002161AA,Ubiquitin ligase FWD1,XM_006526607,XM_006526607.1,XM_006526608,XM_006526608.1,XM_006526609,XM_006526609.1,XM_006526610,XM_006526610.1,XM_006526611,XM_006526611.1,XM_006526612,XM_006526612.1,XM_006526613,XM_006526613.1,XM_006526614,XM_006526614.1,XM_006526615,XM_006526615.1,XP_006526670,XP_006526670.1,XP_006526671,XP_006526671.1,XP_006526672,XP_006526672.1,XP_006526673,XP_006526673.1,XP_006526674,XP_006526674.1,XP_006526675,XP_006526675.1,XP_006526676,XP_006526676.1,XP_006526677,XP_006526677.1,XP_006526678,XP_006526678.1,b-TrCP,beta-TrCP,beta-transducin repeat containing protein,mE3RS-IkappaB,mmu:12234,pIkappaB-E3 receptor subunit,uc008hqx.2,uc008hqy.2,uc008hqz.2,uc033hks.1
Cebpa	10090.ENSMUSP00000096129	CCAAT/enhancer-binding protein alpha; Transcription factor that coordinates proliferation arrest and the differentiation of myeloid progenitors, adipocytes, hepatocytes, and cells of the lung and the placenta. Binds directly to the consensus DNA sequence 5'-T[TG]NNGNAA[TG]-3' acting as an activator on distinct target genes. During early embryogenesis, plays essential and redundant functions with CEBPB. Essential for the transition from common myeloid progenitors (CMP) to granulocyte/monocyte progenitors (GMP). Critical for the proper development of the liver and the lung. Necessary for [...] 	https://smart.embl.de/smart/DDvec.cgi?smart=359:BRLZ(281|345)+	12606,AAA37374.1,AAH11118.1,AAH28890.1,AAH51102.1,AAH58161.1,BC011118,BC028890,BC051102,BC058161,C/EBP alpha,C/ebpalpha,CBF-A,CCAAT/enhancer binding protein (C/EBP), alpha,CCAAT/enhancer-binding protein alpha,CCDS21145.1,CEBPA,CEBPA_MOUSE,Cebp,Cebpa,Cebpa-201,ENSMUSG00000034957,ENSMUSP00000096129,ENSMUST00000042985,M62362,MGI:99480,Mm.349667,NM_001287514,NM_001287514.1,NM_001287515,NM_001287515.1,NM_001287521,NM_001287521.1,NM_001287523,NM_001287523.1,NM_007678,NM_007678.3,NP_001274443,NP_001274443.1,NP_001274444,NP_001274444.1,NP_001274450,NP_001274450.1,NP_001274452,NP_001274452.1,NP_031704,NP_031704.2,P53566,Q91XB6,UPI0000001A61,mmu:12606,uc009gjl.2
Chd3	10090.ENSMUSP00000104301	Chromodomain-helicase-dna-binding protein 3; Chromodomain helicase DNA binding protein 3	https://smart.embl.de/smart/DDvec.cgi?smart=2055:COIL(5|49)+Pfam_CHDNT(200|253)+PHD(434|477)+RING(511|552)+CHROMO(558|637)+CHROMO(681|730)+DEXDc(784|996)+HELICc(1142|1226)+DUF1087(1345|1409)+DUF1086(1415|1571)+Pfam_CHDCT2(1789|1960)+	216848,2600010P09Rik,3.6.4.12,AAH30435.1,AAH55484.1,AF020312,AL596125,B0QZH7,B0QZH8,B1AR17,B1AR17_MOUSE,BC030435,BC055484,CCDS48825.2,CHD3,Chd3,Chd3-001,Chd3-002,Chd3-003,Chd3-004,Chd3-005,Chd3-006,Chd3-007,Chd3-008,Chd3-009,Chd3-201,Chd7,Chromodomain helicase DNA binding protein 3,Chromodomain helicase DNA-binding protein 3,Chromodomain-helicase-DNA-binding protein 3 ,E9Q614,EC 3.6.4.12,ENSMUSG00000018474,ENSMUSP00000006726,ENSMUSP00000058386,ENSMUSP00000071613,ENSMUSP00000090649,ENSMUSP00000090650,ENSMUSP00000104301,ENSMUSP00000114520,ENSMUSP00000118172,ENSMUSP00000121192,ENSMUSP00000122137,ENSMUST00000006726,ENSMUST00000053025,ENSMUST00000071693,ENSMUST00000092971,ENSMUST00000092972,ENSMUST00000108661,ENSMUST00000122992,ENSMUST00000128981,ENSMUST00000135909,ENSMUST00000144332,ENSMUST00000144701,ENSMUST00000146930,ENSMUST00000151436,ENSMUST00000154046,MGI:1344395,Mi-2 alpha,Mm.178246,NM_146019,NM_146019.3,NM_146019.4,NP_666131,NP_666131.3,OTTMUSG00000005975,OTTMUSP00000006184,OTTMUSP00000006185,OTTMUSP00000006186,OTTMUSP00000006187,OTTMUSP00000006188,OTTMUST00000013358,OTTMUST00000013359,OTTMUST00000013360,OTTMUST00000013361,OTTMUST00000013362,OTTMUST00000013363,OTTMUST00000013364,OTTMUST00000013365,OTTMUST00000013366,Prp7,Prp9-1,Q7TML9,Q8K0T3,UPI00001E5DA6,UPI000049C6B4,UPI000049C6B5,UPI000059DC83,UPI0000DBECE3,UPI0000F08883,XM_006532884,XM_006532884.1,XM_006532885,XM_006532885.1,XM_006532886,XM_006532886.1,XM_006532888,XM_006532888.1,XM_006532890,XM_006532890.1,XP_006532942,XP_006532942.1,XP_006532943,XP_006532943.1,XP_006532944,XP_006532944.1,XP_006532945,XP_006532945.1,XP_006532946,XP_006532946.1,XP_006532947,XP_006532947.1,XP_006532948,XP_006532948.1,XP_006532949,XP_006532949.1,XP_006532951,XP_006532951.1,XP_006532953,XP_006532953.1,chromodomain helicase DNA binding protein 3,mmu:216848,uc029rmi.2
Chd4	10090.ENSMUSP00000060054	Chromodomain-helicase-DNA-binding protein 4; Component of the histone deacetylase NuRD complex which participates in the remodeling of chromatin by deacetylating histones	https://smart.embl.de/smart/DDvec.cgi?smart=1915:Pfam_CHDNT(157|210)+PHD(365|408)+RING(445|486)+CHROMO(492|572)+CHROMO(613|670)+DEXDc(715|927)+HELICc(1073|1157)+DUF1087(1282|1346)+DUF1086(1359|1516)+Pfam_CHDCT2(1728|1899)+	107932,2700085N05,3.6.4.12,9430004K15,9530019N15Rik,A430041P19,AA617397,AAH06035.1,AAH58578.1,AAH71255.1,AC134529,AC166162,AK034549,AK040005,AK132004,AK145532,AK148402,AK153826,BAC28749.1,BAE20563.1,BAE20933.1,BAE26488.1,BAE28532.1,BAE32198.1,BC005710,BC006035,BC058578,BC071255,C920008E20,CCDS20543.1,CHD-4,CHD4,CHD4_MOUSE,Chd4,Chd4-001,Chd4-002,Chd4-003,Chd4-004,Chd4-005,Chd4-006,Chd4-007,Chd4-008,Chromodomain helicase DNA binding protein 4,Chromodomain-helicase-DNA-binding protein 4,Chromodomain-helicase-DNA-binding protein 4 ,D6Ertd380e,E9QAS4,E9QAS5,EC 3.6.4.12,EDK99801.1,ENSMUSG00000063870,ENSMUSP00000060054,ENSMUSP00000108009,ENSMUSP00000108011,ENSMUSP00000120704,ENSMUSP00000122806,ENSMUST00000056889,ENSMUST00000112390,ENSMUST00000112392,ENSMUST00000124317,ENSMUST00000132794,ENSMUST00000138968,ENSMUST00000155261,ENSMUST00000155932,F6WR45,G370133P11,G5E8V7,I1C0011E07,MGI:1344380,Mi-2beta,Mm.333388,Mm.475105,NM_001346610.1,NM_145979,NM_145979.2,NP_001333539,NP_001333539.1,NP_666091,NP_666091.1,OTTMUSG00000023920,OTTMUSP00000028311,OTTMUSP00000028312,OTTMUSP00000028313,OTTMUSP00000028314,OTTMUSP00000028315,OTTMUST00000058439,OTTMUST00000058440,OTTMUST00000058441,OTTMUST00000058442,OTTMUST00000058443,OTTMUST00000058444,OTTMUST00000058445,OTTMUST00000058446,Q3U582,Q3UFM8,Q3ULG0,Q3V265,Q3V3I7,Q6IQY9,Q6PDQ2,Q8BM83,Q99JM0,UPI00001D3F7D,UPI0001548EA6,UPI00015AA466,UPI00015AA467,UPI00015AA468,XM_006505285,XM_006505285.1,XM_006505286,XM_006505286.1,XM_006505287,XM_006505287.1,XP_006505348,XP_006505348.1,XP_006505349,XP_006505349.1,XP_006505350,XP_006505350.1,chromodomain helicase DNA binding protein 4,mKIAA4075,mmu:107932,uc009dtk.1
Creb1	10090.ENSMUSP00000140112	Cyclic AMP-responsive element-binding protein 1; Phosphorylation-dependent transcription factor that stimulates transcription upon binding to the DNA cAMP response element (CRE), a sequence present in many viral and cellular promoters. Transcription activation is enhanced by the TORC coactivators which act independently of Ser-133 phosphorylation. Involved in different cellular processes including the synchronization of circadian rhythmicity and the differentiation of adipose cells; Belongs to the bZIP family	https://smart.embl.de/smart/DDvec.cgi?smart=341:Pfam_pKID(113|153)+BRLZ(281|339)+	12912,1DH3,2310001E10Rik,3526402H21Rik,AAA37456.1,AAL47130.1,AAL47131.1,AC166336,AF448507,AF448508,AK044992,AK044993,AV083133,B130018C19,B130018C21,BAC32173.1,BAC32174.1,CAA47953.1,CAA47954.1,CAA47956.1,CAA63242.1,CAMP responsive element binding protein 1,CCDS15004.1,CCDS15005.1,CCDS48280.1,CREB,CREB-1,CREB1,CREB1_MOUSE,Creb,Creb-1,Creb1,Creb1-001,Creb1-002,Creb1-003,Creb1-004,Creb1-005,Creb1-006,Creb1-007,Creb1-008,Creb1-009,Creb1-010,Creb1-011,Cyclic AMP-responsive element-binding protein 1,EDL00200.1,EDL00202.1,ENSMUSG00000025958,ENSMUSP00000027097,ENSMUSP00000027098,ENSMUSP00000027099,ENSMUSP00000059973,ENSMUSP00000084624,ENSMUSP00000126381,ENSMUSP00000129406,ENSMUSP00000132860,ENSMUSP00000139995,ENSMUSP00000140112,ENSMUSP00000140189,ENSMUSP00000140649,ENSMUST00000027097,ENSMUST00000027098,ENSMUST00000027099,ENSMUST00000049932,ENSMUST00000087366,ENSMUST00000169761,ENSMUST00000171164,ENSMUST00000171369,ENSMUST00000185594,ENSMUST00000186335,ENSMUST00000187035,ENSMUST00000187811,ENSMUST00000188855,ENSMUST00000190348,ENSMUST00000190876,ENSMUST00000190979,M95106,MGI:88494,Mm.403625,Mm.420153,Mm.422634,Mm.472515,Mm.481816,Mm.490964,NM_001037726,NM_001037726.1,NM_009952,NM_009952.2,NM_133828,NM_133828.2,NP_001032815,NP_001032815.1,NP_034082,NP_034082.1,NP_598589,NP_598589.2,OTTMUSG00000047617,OTTMUSP00000067234,OTTMUSP00000067235,OTTMUSP00000067236,OTTMUSP00000067237,OTTMUSP00000067238,OTTMUSP00000067239,OTTMUSP00000067240,OTTMUST00000122762,OTTMUST00000122763,OTTMUST00000122764,OTTMUST00000122765,OTTMUST00000122766,OTTMUST00000122767,OTTMUST00000122768,OTTMUST00000122769,OTTMUST00000122770,OTTMUST00000122771,OTTMUST00000122772,Q01147,Q543W0,Q547S9,Q61441,Q62347,UPI0000000F10,UPI0000004066,UPI00000E7EE4,UPI00000E8478,X67719,X67721,X67722,X67723,X67724,X67725,X67726,X67727,X67728,X92497,XM_006495650,XM_006495650.1,XM_006495650.3,XM_006495651,XM_006495651.1,XM_006495651.3,XM_006495652,XM_006495652.1,XM_006495653,XM_006495653.1,XM_006495654,XM_006495654.1,XM_006495655,XM_006495655.1,XM_017314080.1,XM_017314099.1,XP_006495713,XP_006495713.1,XP_006495714,XP_006495714.1,XP_006495715,XP_006495715.1,XP_006495716,XP_006495716.1,XP_006495717,XP_006495717.1,XP_006495718,XP_006495718.1,XP_017169569.1,XP_017169588.1,cAMP responsive element binding protein 1,cAMP-responsive element-binding protein 1,mmu:12912,uc007bgr.1,uc007bgs.1,uc007bgt.1
