#node	identifier	domain_summary_url	annotation	other_names_and_aliases
Max	10090.ENSMUSP00000106025	Transcription regulator. Forms a sequence-specific DNA- binding protein complex with MYC or MAD which recognizes the core sequence 5'-CAC[GA]TG-3'. The MYC:MAX complex is a transcriptional activator, whereas the MAD:MAX complex is a repressor. CpG methylation of the recognition site greatly inhibits DNA binding, suggesting that DNA methylation may regulate the MYC:MAX complex in vivo. May repress transcription via the recruitment of a chromatin remodeling complex containing H3 'Lys-9' histone methyltransferase activity. Represses MYC transcriptional activity from E-box elements (By sim [...] 	https://smart.embl.de/smart/DDvec.cgi?smart=160:HLH(29|80)+	17187,1A93,2A93,3U5V,A730011M08,AA960152,AAI38672.1,AAI38673.1,AAI45370.1,AI875693,AK080431,B2RS19,BAC37914.1,BC138671,BC138672,BC145369,CCDS36479.1,CCDS49094.1,ENSMUSG00000059436,ENSMUSP00000080778,ENSMUSP00000106025,ENSMUSP00000130085,ENSMUST00000082136,ENSMUST00000110395,ENSMUST00000168040,MAX,MAX_MOUSE,MGI:96921,Max,Max protein,Max-201,Max-202,Mm.491131,Myc-associated factor X,Myc-binding novel HLH/LZ protein,Myn,NM_001146176,NM_001146176.1,NM_008558,NM_008558.2,NP_001139648,NP_001139648.1,NP_032584,NP_032584.2,P28574,Protein max,Protein myn,Q8C4Y1,UPI00000E9D36,UPI000017C700,XP_006515587,XP_006515587.1,bHLHd4,bHLHd5,bHLHd6,bHLHd7,bHLHd8,mmu:17187,uc007nyw.2,uc007nyx.2
Mbd3	10090.ENSMUSP00000089948	Methyl-CpG-binding domain protein 3; Acts as transcriptional repressor and plays a role in gene silencing. Does not bind DNA by itself. Binds to DNA with a preference for sites containing methylated CpG dinucleotides (in vitro). Binds to a lesser degree DNA containing unmethylated CpG dinucleotides (By similarity). Recruits histone deacetylases and DNA methyltransferases	https://smart.embl.de/smart/DDvec.cgi?smart=285:MBD(3|76)+Pfam_MBDa(79|148)+Pfam_MBD_C(152|243)+	17192,AAC68877.1,AAD48909.1,AAH38264.1,AF072248,AF120995,AI181826,AU019209,BC038264,CCDS24020.1,D3YTR4,D3YTR5,ENSMUSG00000035478,ENSMUSP00000035834,ENSMUSP00000089948,ENSMUSP00000100984,ENSMUSP00000100985,ENSMUSP00000100986,ENSMUSP00000120675,ENSMUST00000039675,ENSMUST00000092295,ENSMUST00000105347,ENSMUST00000105348,ENSMUST00000105349,ENSMUST00000125618,ENSMUST00000142997,MBD3,MBD3_MOUSE,MGI:1333812,Mbd3,Mbd3-001,Mbd3-002,Mbd3-003,Mbd3-004,Mbd3-005,Mbd3-006,Methyl-CpG binding domain protein 3,Methyl-CpG-binding domain protein 3,Methyl-CpG-binding protein MBD3,Mm.7142,NM_001306143.1,NM_013595,NM_013595.2,NM_013595.3,NP_001293072.1,NP_038623,NP_038623.1,OTTMUSG00000019125,OTTMUSP00000020630,OTTMUSP00000020631,OTTMUSP00000020632,OTTMUSP00000020633,OTTMUSP00000020634,OTTMUST00000045811,OTTMUST00000045812,OTTMUST00000045813,OTTMUST00000045814,OTTMUST00000045815,OTTMUST00000045816,Q792D3,Q8CFJ1,Q9Z2D8,UPI0000029802,UPI00000E8FCD,UPI0000353F40,UPI0000F2216D,UPI0000F2216E,XM_006513302,XM_006513302.1,XM_006513303,XM_006513303.1,XM_006513304,XM_006513304.1,XP_006513364,XP_006513364.1,XP_006513365,XP_006513365.1,XP_006513366,XP_006513366.1,XP_006513367,XP_006513367.1,methyl-CpG binding domain protein 3,mmu:17192,uc007gda.1,uc007gdb.1
Mecp2	10090.ENSMUSP00000033770	Methyl-CpG-binding protein 2; Chromosomal protein that binds to methylated DNA. It can bind specifically to a single methyl-CpG pair. It is not influenced by sequences flanking the methyl-CpGs. Mediates transcriptional repression through interaction with histone deacetylase and the corepressor SIN3. Binds both 5-methylcytosine (5mC) and 5-hydroxymethylcytosine (5hmC)-containing DNA, with a preference for 5-methylcytosine (5mC)	https://smart.embl.de/smart/DDvec.cgi?smart=501:MBD(109|186)+AT_hook(202|214)+AT_hook(282|294)+	1500041B07Rik,17257,5NAF,AAC68880.1,AAF33024.1,AAH27153.1,AF072251,AF121351,AF158181,AJ132922,AK158664,B1AUZ2,B1AUZ3,BAE34602.1,BB130002,BC027153,CAB46495.1,CAM18741.1,CAM18742.1,CCDS41016.1,CCDS41017.1,D3YY81,D3Z7U4,D630021H01Rik,ENSMUSG00000031393,ENSMUSP00000033770,ENSMUSP00000085680,ENSMUSP00000098314,ENSMUSP00000118842,ENSMUSP00000119947,ENSMUSP00000127115,ENSMUST00000033770,ENSMUST00000088342,ENSMUST00000100750,ENSMUST00000123362,ENSMUST00000140399,ENSMUST00000170481,K230047M20,MECP2,MECP2_MOUSE,MGI:99918,Mbd5,MeCp-2 protein,MeCp2,Mecp2,Mecp2-001,Mecp2-002,Mecp2-003,Mecp2-004,Mecp2-201,Methyl CpG binding protein 2,Methyl-CpG-binding protein 2,Mm.131408,Mm.406064,Mm.486795,NM_001081979,NM_001081979.1,NM_001081979.2,NM_010788,NM_010788.3,NM_010788.4,NP_001075448,NP_001075448.1,NP_034918,NP_034918.1,OTTMUSG00000017654,OTTMUSP00000019241,OTTMUSP00000019680,OTTMUSP00000045815,OTTMUSP00000046640,OTTMUST00000042852,OTTMUST00000043832,OTTMUST00000049596,OTTMUST00000086197,Q3TYG1,Q9Z2D6,UPI0000001A34,UPI0000D8AEFF,UPI000198D03B,UPI000198D03C,WBP10,XM_006527888,XM_006527888.1,XP_006527951,XP_006527951.1,methyl CpG binding protein 2,mmu:17257,uc009tnt.2,uc009tnt.3,uc009tnu.2,uc009tnu.3
Mta1	10090.ENSMUSP00000009099	Metastasis-associated protein MTA1; Transcriptional coregulator which can act as both a transcriptional corepressor and coactivator. As a part of the histone-deacetylase multiprotein complex (NuRD), regulates transcription of its targets by modifying the acetylation status of the target chromatin and cofactor accessibility to the target DNA. In conjunction with other components of NuRD, acts as a transcriptional corepressor of BRCA1, ESR1, TFF1 and CDKN1A. Acts as a transcriptional coactivator of BCAS3, PAX5 and SUMO2, independent of the NuRD complex. Stimulates the expression of WNT1  [...] 	https://smart.embl.de/smart/DDvec.cgi?smart=715:BAH(4|164)+ELM2(167|221)+SANT(284|333)+ZnF_GATA(387|441)+Pfam_MTA_R1(464|541)+Pfam_MTA_R1(656|695)+	116870,AAK83044.1,AAM97587.1,AAM97588.1,AB039744,AB794093,AB794094,AB794096,AB794098,AB794101,AB794103,AF288137,AF463504,BAC57413.1,BAM86004.1,BAM86005.1,BAM86007.1,BAM86009.1,BAM86012.1,BAM86014.1,CCDS36574.1,E9PX23,ENSMUSG00000021144,ENSMUSP00000009099,ENSMUSP00000064338,ENSMUSP00000105341,ENSMUSP00000105345,ENSMUSP00000105348,ENSMUSP00000105349,ENSMUST00000009099,ENSMUST00000069690,ENSMUST00000109719,ENSMUST00000109723,ENSMUST00000109726,ENSMUST00000109727,ENSMUST00000130926,ENSMUST00000134488,ENSMUST00000156030,F8WHY8,M1VHG1,M1VHG3,M1VHG6,M1VMF6,MGI:2150037,MTA1,MTA1_MOUSE,Metastasis associated 1,Metastasis-associated protein MTA,Metastasis-associated protein MTA1,Mm.212577,Mta1,Mta1-001,Mta1-002,Mta1-003,Mta1-004,Mta1-005,Mta1-006,Mta1-201,Mta1-202,NM_054081,NM_054081.2,NP_001333625,NP_473422,NP_473422.2,OTTMUSG00000017198,OTTMUSP00000018706,OTTMUSP00000018707,OTTMUSP00000018708,OTTMUST00000041646,OTTMUST00000041647,OTTMUST00000041648,OTTMUST00000041649,OTTMUST00000041650,OTTMUST00000041651,Q80UI1,Q8K4B0,Q8K4D4,Q924K9,UPI0000028BBD,UPI0000214B49,UPI0000214B4A,XM_006515420,XM_006515420.1,XM_006515422,XM_006515422.1,XM_006515424,XM_006515424.1,XM_006515425,XM_006515425.1,XM_006515426,XM_006515426.1,XM_006515427,XM_006515427.1,XM_006515428,XM_006515428.1,XM_006515429,XM_006515429.1,XM_006515430,XM_006515430.1,XM_006515431,XM_006515431.1,XM_006536316,XM_006536316.1,XM_006536319,XM_006536319.1,XM_006536320,XM_006536320.1,XM_006536321,XM_006536321.1,XM_006536322,XM_006536322.1,XM_006536323,XM_006536323.1,XM_006536324,XM_006536324.1,XM_006536325,XM_006536325.1,XM_006536326,XM_006536326.1,XM_006536327,XM_006536327.1,XP_006515481,XP_006515481.1,XP_006515482,XP_006515482.1,XP_006515483,XP_006515483.1,XP_006515484,XP_006515484.1,XP_006515485,XP_006515485.1,XP_006515486,XP_006515486.1,XP_006515487,XP_006515487.1,XP_006515488,XP_006515488.1,XP_006515489,XP_006515489.1,XP_006515490,XP_006515490.1,XP_006515491,XP_006515491.1,XP_006515492,XP_006515492.1,XP_006515493,XP_006515493.1,XP_006515494,XP_006515494.1,XP_006536377,XP_006536377.1,XP_006536378,XP_006536378.1,XP_006536379,XP_006536379.1,XP_006536380,XP_006536380.1,XP_006536381,XP_006536381.1,XP_006536382,XP_006536382.1,XP_006536383,XP_006536383.1,XP_006536384,XP_006536384.1,XP_006536385,XP_006536385.1,XP_006536386,XP_006536386.1,XP_006536387,XP_006536387.1,XP_006536388,XP_006536388.1,XP_006536389,XP_006536389.1,XP_006536390,XP_006536390.1,XR_381473,XR_381473.1,XR_381474,XR_381474.1,XR_389991,XR_389991.1,XR_389992,XR_389992.1,metastasis associated 1,mmu:116870,uc007pfv.1,uc007pfw.1,uc007pfx.1,uc033gfz.1
Mta2	10090.ENSMUSP00000093959	Metastasis-associated gene family, member 2; Metastasis-associated protein MTA2; May be involved in the regulation of gene expression as repressor and activator. The repression might be related to covalent modification of histone proteins	https://smart.embl.de/smart/DDvec.cgi?smart=668:BAH(4|144)+ELM2(147|201)+SANT(264|313)+ZnF_GATA(361|415)+Pfam_MTA_R1(447|524)+	23942,AAD51281.1,AAH79847.1,AAL30174.1,AB047977,AF159259,AF348083,AK088158,AK147099,AK149834,AK159979,AW550797,BAB79231.1,BAC40180.1,BAE27675.1,BAE29113.1,BAE35530.1,BC079847,CCDS29561.1,E430005D10,ENSMUSG00000071646,ENSMUSP00000093959,ENSMUST00000096240,ENSMUST00000132463,ENSMUST00000135300,ENSMUST00000137956,ENSMUST00000151386,ENSMUST00000169535,G530021P08,I420041M24,I920165M04,MGI:1346340,MTA2,MTA2_MOUSE,Mata1l1,Metastasis-associated 1-like 1,Metastasis-associated gene family, member 2,Metastasis-associated protein MTA,Metastasis-associated protein MTA2,Mm.25339,Mm.393929,Mta1l1,Mta2,Mta2-001,Mta2-002,Mta2-003,Mta2-004,Mta2-005,Mta2-006,NM_011842,NM_011842.3,NP_035972,NP_035972.3,OTTMUSG00000017291,OTTMUSP00000018855,OTTMUST00000041924,OTTMUST00000041925,OTTMUST00000041926,OTTMUST00000041927,OTTMUST00000041928,OTTMUST00000094779,Q3TVT8,Q3UDZ8,Q9R190,UPI0000020D7A,XP_006527125,XP_006527125.1,XP_006527126,XP_006527126.1,metastasis-associated gene family, member 2,mmta2,mmu:23942,uc008gof.1
Mta3	10090.ENSMUSP00000068931	Metastasis-associated protein MTA3; Plays a role in maintenance of the normal epithelial architecture through the repression of SNAI1 transcription in a histone deacetylase-dependent manner, and thus the regulation of E-cadherin levels. Contributes to transcriptional repression by BCL6 (By similarity)	https://smart.embl.de/smart/DDvec.cgi?smart=591:BAH(4|147)+ELM2(150|203)+SANT(266|315)+ZnF_GATA(371|425)+Pfam_MTA_R1(458|534)+	1110002J22Rik,116871,2CRG,AAH22124.1,AAK83045.1,AC084386,AC155160,AC155636,AF288138,AK129318,AK146721,AK146905,AK147197,AK154856,BAC98128.1,BAE27384.1,BAE27518.1,BAE27755.1,BAE32881.1,BC022124,CCDS28997.1,CCDS50195.1,CCDS50196.1,CCDS50197.1,E9Q794,ENSMUSG00000055817,ENSMUSP00000068931,ENSMUSP00000094876,ENSMUSP00000107963,ENSMUSP00000107968,ENSMUSP00000107969,ENSMUSP00000107971,ENSMUSP00000134775,ENSMUSP00000135064,ENSMUSP00000135752,ENSMUST00000067826,ENSMUST00000097277,ENSMUST00000112344,ENSMUST00000112349,ENSMUST00000112350,ENSMUST00000112352,ENSMUST00000175920,ENSMUST00000176054,ENSMUST00000176816,ENSMUST00000177069,ENSMUST00000177416,F630109M10,H3BIY7,H3BJP3,H3BLE1,I920046O08,I920073C17,K630036M20,MGI:2151172,MTA3,MTA3_MOUSE,Metastasis associated 3,Metastasis-associated protein MTA,Metastasis-associated protein MTA3,Mm.277668,Mm.415902,Mta3,Mta3-001,Mta3-002,Mta3-003,Mta3-004,Mta3-005,Mta3-006,Mta3-007,Mta3-008,Mta3-009,NM_001171052,NM_001171052.1,NM_001171053,NM_001171053.1,NM_001171054,NM_001171054.1,NM_054082,NM_054082.2,NP_001164523,NP_001164523.1,NP_001164524,NP_001164524.1,NP_001164525,NP_001164525.1,NP_473423,NP_473423.1,OTTMUSG00000017301,OTTMUSP00000018873,OTTMUSP00000018907,OTTMUSP00000018908,OTTMUSP00000018909,OTTMUSP00000018910,OTTMUSP00000061412,OTTMUSP00000061413,OTTMUST00000041971,OTTMUST00000042045,OTTMUST00000042046,OTTMUST00000042047,OTTMUST00000042048,OTTMUST00000110169,OTTMUST00000110170,OTTMUST00000110171,OTTMUST00000110172,Q3U3A7,Q3UII8,Q6ZPV1,Q8VC18,Q924K8,UPI0000028FC5,UPI000016CA45,UPI00005AC5AA,UPI0000DBED21,UPI0002467844,UPI0002467845,UPI0002467846,XM_006523506,XM_006523506.1,XM_006523508,XM_006523508.1,XM_006523510,XM_006523510.1,XM_006523511,XM_006523511.1,XP_006523569,XP_006523569.1,XP_006523570,XP_006523570.1,XP_006523571,XP_006523571.1,XP_006523572,XP_006523572.1,XP_006523573,XP_006523573.1,XP_006523574,XP_006523574.1,mKIAA1266,metastasis associated 3,mmu:116871,uc008dsf.2,uc008dsg.2,uc008dsh.2,uc008dsj.2,uc012axw.1
Nanog	10090.ENSMUSP00000012540	Homeobox protein NANOG; Transcription regulator involved in inner cell mass and embryonic stem (ES) cells proliferation and self-renewal. Imposes pluripotency on ES cells and prevents their differentiation towards extraembryonic endoderm and trophectoderm lineages. Blocks bone morphogenetic protein-induced mesoderm differentiation of ES cells by physically interacting with SMAD1 and interfering with the recruitment of coactivators to the active SMAD transcriptional complexes. Acts as a transcriptional activator or repressor. Binds optimally to the DNA consensus sequence 5'-TAAT[GT][GT] [...] 	https://smart.embl.de/smart/DDvec.cgi?smart=305:HOX(96|158)+	2410002E02,2410002E02Rik,2VI6,71950,A2RS90,AAI32018.1,AAI37874.1,AAI44996.1,AAI44997.1,AAO67362.1,AAP92157.1,AAS57554.1,AAS57556.1,AB093574,AF507043,AK010332,AY278951,AY455282,AY455285,B7ZN41,BAC76998.1,BAE43219.1,BC132017,BC137873,BC144995,BC144996,CCDS39623.1,EDK99694.1,ENK,ENSMUSG00000012396,ENSMUSP00000012540,ENSMUSP00000108199,ENSMUSP00000108200,ENSMUSP00000108201,ENSMUST00000012540,ENSMUST00000112580,ENSMUST00000112581,ENSMUST00000112582,ES cell-associated protein 4,Ecat4,Enk,Homeobox protein NANOG,Homeobox protein Nanog,Homeobox transcription factor Nanog,MGI:1919200,Mm.485537,Mm.491626,Mm.6047,NANOG,NANOG_MOUSE,NM_001289828,NM_001289828.1,NM_001289830,NM_001289830.1,NM_001289831,NM_001289831.1,NM_028016,NM_028016.2,NM_028016.3,NP_001276757,NP_001276757.1,NP_001276759,NP_001276759.1,NP_001276760,NP_001276760.1,NP_082292,NP_082292.1,Nanog,Nanog homeobox,Nanog-001,Nanog-002,Nanog-003,OTTMUSG00000023511,OTTMUSP00000027613,OTTMUSP00000027614,OTTMUSP00000027615,OTTMUST00000057270,OTTMUST00000057271,OTTMUST00000057272,Q6SMR1,Q7TN85,Q80Z64,UPI0000021256,UPI000035147E,XM_006506651,XM_006506651.2,XP_006506714,XP_006506714.1,ecat4,mmu:71950,uc009dpo.2,uc029vyl.2,uc033iul.1
Ncor1	10090.ENSMUSP00000068974	Nuclear receptor co-repressor 1; Mediates transcriptional repression by certain nuclear receptors. Part of a complex which promotes histone deacetylation and the formation of repressive chromatin structures which may impede the access of basal transcription factors. Participates in the transcriptional repressor activity produced by BCL6. Recruited by ZBTB7A to the androgen response elements/ARE on target genes, negatively regulates androgen receptor signaling and androgen-induced cell proliferation (By similarity). Mediates the NR1D1-dependent repression and circadian regulation of TSH [...] 	https://smart.embl.de/smart/DDvec.cgi?smart=291:Pfam_GPS2_interact(150|239)+	20185,2900090F09,5730405M06,5730405M06Rik,9930037N14,A230020K14Rik,AAH86657.1,AB093281,AK013831,AK077420,AK137695,AL596110,BAB29007.1,BAC36792.1,BAC41465.1,BAE23465.1,BC086657,BX248411,CCDS56781.1,CCDS56782.1,CH466601,E0CYX5,E9Q2B2,E9Q8K6,E9Q9Y2,EDL10341.1,EDL10342.1,ENSMUSG00000018501,ENSMUSP00000018645,ENSMUSP00000038900,ENSMUSP00000068974,ENSMUSP00000090689,ENSMUSP00000090690,ENSMUSP00000090691,ENSMUSP00000098627,ENSMUSP00000098628,ENSMUSP00000098629,ENSMUSP00000098630,ENSMUSP00000104348,ENSMUSP00000121806,ENSMUSP00000122647,ENSMUSP00000122654,ENSMUSP00000123822,ENSMUSP00000124045,ENSMUSP00000124120,ENSMUSP00000124175,ENSMUSP00000124332,ENSMUSP00000124698,ENSMUSP00000124761,ENSMUSP00000125209,ENSMUSP00000125317,ENSMUSP00000125458,ENSMUSP00000131091,ENSMUSP00000131448,ENSMUST00000018645,ENSMUST00000037575,ENSMUST00000069456,ENSMUST00000093011,ENSMUST00000093012,ENSMUST00000093013,ENSMUST00000101066,ENSMUST00000101067,ENSMUST00000101068,ENSMUST00000101069,ENSMUST00000108708,ENSMUST00000124027,ENSMUST00000127471,ENSMUST00000131911,ENSMUST00000141447,ENSMUST00000151498,ENSMUST00000155486,ENSMUST00000155712,ENSMUST00000156740,ENSMUST00000159069,ENSMUST00000159224,ENSMUST00000159315,ENSMUST00000160171,ENSMUST00000161116,ENSMUST00000161281,ENSMUST00000161288,ENSMUST00000161432,ENSMUST00000161699,ENSMUST00000161767,ENSMUST00000162077,ENSMUST00000162236,ENSMUST00000164085,ENSMUST00000166761,F6TRR6,F7CTX2,MGI:1349717,Mm.271814,Mm.365706,Mm.437515,N-CoR,N-CoR1,NCOR1,NCOR1_MOUSE,NM_001252313,NM_001252313.1,NM_011308,NM_011308.3,NM_177229,NM_177229.3,NP_001239242,NP_001239242.1,NP_035438,NP_035438.3,NP_796203,NP_796203.1,Ncor1,Ncor1-001,Ncor1-002,Ncor1-003,Ncor1-004,Ncor1-006,Ncor1-007,Ncor1-008,Ncor1-009,Ncor1-010,Ncor1-011,Ncor1-012,Ncor1-013,Ncor1-014,Ncor1-015,Ncor1-016,Ncor1-017,Ncor1-018,Ncor1-019,Ncor1-020,Ncor1-021,Ncor1-022,Ncor1-023,Ncor1-024,Ncor1-025,Ncor1-201,Ncor1-202,Nuclear receptor co-repressor 1,Nuclear receptor corepressor 1,OTTMUSG00000005855,OTTMUSP00000006054,OTTMUSP00000006056,OTTMUSP00000006058,OTTMUSP00000006060,OTTMUSP00000006061,OTTMUSP00000047846,OTTMUSP00000047847,OTTMUSP00000047848,OTTMUSP00000047849,OTTMUSP00000047850,OTTMUSP00000047876,OTTMUSP00000047877,OTTMUSP00000047878,OTTMUSP00000047879,OTTMUSP00000047880,OTTMUSP00000047881,OTTMUST00000013021,OTTMUST00000013023,OTTMUST00000013026,OTTMUST00000013027,OTTMUST00000013028,OTTMUST00000013029,OTTMUST00000013030,OTTMUST00000013031,OTTMUST00000013032,OTTMUST00000087853,OTTMUST00000087854,OTTMUST00000087855,OTTMUST00000087856,OTTMUST00000087857,OTTMUST00000087858,OTTMUST00000087903,OTTMUST00000087904,OTTMUST00000087905,OTTMUST00000087906,OTTMUST00000087907,OTTMUST00000087908,OTTMUST00000087909,OTTMUST00000087910,OTTMUST00000087911,Q3UV08,Q5PRE9,Q5RIM6,Q5RIN0,Q60812,Q60974,Q8BK32,Q8CHB6,Q9CUV3,RIP13,Retinoid X receptor-interacting protein 13,Rxrip13,UPI00000215EC,UPI00000E8DBB,UPI00000EB615,UPI00004706DA,UPI00005ABDB0,UPI0000D63AC4,UPI0001DD34E6,UPI0001DD34E7,UPI0001DD34E8,UPI0001DD34E9,UPI0001DD34EA,UPI0001DD34EB,UPI0001DD34EC,UPI0001DD34ED,UPI0001DD34EE,UPI0001DD34EF,XM_006532623,XM_006532623.1,XM_006532624,XM_006532624.1,XP_006532684,XP_006532684.1,XP_006532686,XP_006532686.1,XP_006532687,XP_006532687.1,XP_006532688,XP_006532688.1,XP_006532690,XP_006532690.1,mKIAA1047,mmu:20185,nuclear receptor co-repressor 1,uc007jiu.2,uc007jiv.2,uc007jiw.2,uc007jix.2,uc007jiz.1,uc007jjd.2,uc029rmb.1
Ncor2	10090.ENSMUSP00000107033	Nuclear receptor co-repressor 2; Nuclear receptor corepressor 2; Transcriptional corepressor. Mediates the transcriptional repression activity of some nuclear receptors by promoting chromatin condensation, thus preventing access of the basal transcription. Isoform 1 and isoform 5 have different affinities for different nuclear receptors. Involved in the regulation BCL6-dependent of the germinal center (GC) reactions, mainly through the control of the GC B-cells proliferation and survival	https://smart.embl.de/smart/DDvec.cgi?smart=2507:Pfam_GPS2_interact(141|229)+SANT(428|476)+COIL(494|550)+SANT(607|655)+	20602,AAD20944.1,AAD20945.1,AAD22972.1,AC132118,AC139377,AF113001,AF113002,AF125671,AK168836,BAE40660.1,CCDS39285.2,CCDS57381.1,CCDS57382.1,D3Z2J5,E9PY55,E9Q701,E9Q9V0,E9Q9V3,ENSMUSG00000029478,ENSMUSP00000031439,ENSMUSP00000055954,ENSMUSP00000083245,ENSMUSP00000083246,ENSMUSP00000083250,ENSMUSP00000107024,ENSMUSP00000107025,ENSMUSP00000107029,ENSMUSP00000107031,ENSMUSP00000107032,ENSMUSP00000107033,ENSMUSP00000115776,ENSMUSP00000117098,ENSMUSP00000117813,ENSMUSP00000121588,ENSMUSP00000127031,ENSMUST00000031439,ENSMUST00000055256,ENSMUST00000086078,ENSMUST00000086079,ENSMUST00000086083,ENSMUST00000111393,ENSMUST00000111394,ENSMUST00000111398,ENSMUST00000111400,ENSMUST00000111401,ENSMUST00000111402,ENSMUST00000125053,ENSMUST00000130742,ENSMUST00000134404,ENSMUST00000134819,ENSMUST00000138890,ENSMUST00000144354,ENSMUST00000149968,ENSMUST00000168041,F6YAU7,F8VQL9,I920059G03,MGI:1337080,Mm.278646,Mm.472258,N-CoR,N-CoR2,NCOR2,NCOR2_MOUSE,NM_001253904,NM_001253904.1,NM_001253905,NM_001253905.1,NM_011424,NM_011424.3,NP_001240833,NP_001240833.1,NP_001240834,NP_001240834.1,NP_035554,NP_035554.3,Ncor2,Ncor2-001,Ncor2-002,Ncor2-003,Ncor2-004,Ncor2-005,Ncor2-006,Ncor2-007,Ncor2-008,Ncor2-009,Ncor2-010,Ncor2-011,Ncor2-012,Ncor2-201,Nuclear receptor co-repressor 2,Nuclear receptor corepressor 2,OTTMUSG00000017150,OTTMUSP00000018644,OTTMUSP00000018645,OTTMUSP00000018646,OTTMUSP00000018647,OTTMUSP00000018648,OTTMUSP00000018649,OTTMUSP00000018650,OTTMUSP00000018651,OTTMUSP00000018652,OTTMUST00000041505,OTTMUST00000041506,OTTMUST00000041507,OTTMUST00000041508,OTTMUST00000041509,OTTMUST00000041510,OTTMUST00000041511,OTTMUST00000041512,OTTMUST00000041513,OTTMUST00000041514,OTTMUST00000041515,OTTMUST00000041516,Q3TG88,Q9WU42,Q9WU43,Q9WUC1,SMRT,SMRTe,Smrt,T3 receptor-associating factor,TRAC,UPI0000356D11,UPI0000DBED51,UPI0000DBED52,UPI0000DBED53,UPI0000DBED54,UPI0000DBED55,UPI0000DBED56,UPI0000DBED57,UPI0000DBED58,UPI0000E9B4B2,XM_006504281,XM_006504281.1,XM_006504282,XM_006504282.1,XM_006504283,XM_006504283.1,XM_011240831.2,XP_006504344,XP_006504344.1,XP_006504345,XP_006504345.1,XP_006504346,XP_006504346.1,XP_006504347,XP_006504347.1,XP_011239133.1,mmu:20602,nuclear receptor co-repressor 2,uc008zqu.2,uc008zqv.2,uc008zqw.2,uc008zqx.2,uc008zqz.2,uc008zra.2,uc029vor.1
Neurod1	10090.ENSMUSP00000040364	Neurogenic differentiation factor 1; Acts as a transcriptional activator: mediates transcriptional activation by binding to E box-containing promoter consensus core sequences 5'-CANNTG-3'. Associates with the p300/CBP transcription coactivator complex to stimulate transcription of the secretin gene as well as the gene encoding the cyclin-dependent kinase inhibitor CDKN1A. Contributes to the regulation of several cell differentiation pathways, like those that promote the formation of early retinal ganglion cells, inner ear sensory neurons, granule cells forming either the cerebellum or  [...] 	https://smart.embl.de/smart/DDvec.cgi?smart=357:COIL(27|84)+HLH(107|159)+Pfam_Neuro_bHLH(160|284)+	1500000C11,1500032O24,18012,2QL2,AAC52203.1,AAC52204.1,AAH18241.1,AK005073,AK018781,BAB23797.1,BAB31405.1,BC018241,BETA2,BHF-1,Beta-cell E-box transcriptional activator 2,Beta2,CCDS16169.1,ENSMUSG00000034701,ENSMUSP00000040364,ENSMUSP00000085372,ENSMUST00000041099,ENSMUST00000088056,MGI:1339708,Mm.414093,Mm.4636,Mm.470897,NDF1_MOUSE,NEUROD1,NM_010894,NM_010894.2,NP_035024,NP_035024.1,Nd1,NeuroD1,Neurod,Neurod1,Neurod1-001,Neurogenic differentiation 1,Neurogenic differentiation factor 1,OTTMUSG00000013310,OTTMUSP00000014302,OTTMUST00000032176,Q545N9,Q60867,Q60897,U28068,U28888,UPI0000001505,bHLHa3,mmu:18012,neurogenic differentiation 1,uc008kgt.1
Npc2	10090.ENSMUSP00000021668	Epididymal secretory protein E1; Intracellular cholesterol transporter which acts in concert with NPC1 and plays an important role in the egress of cholesterol from the endosomal/lysosomal compartment. Both NPC1 and NPC2 function as the cellular 'tag team duo' (TTD) to catalyze the mobilization of cholesterol within the multivesicular environment of the late endosome (LE) to effect egress through the limiting bilayer of the LE. NPC2 binds unesterified cholesterol that has been released from LDLs in the lumen of the late endosomes/lysosomes and transfers it to the cholesterol-binding po [...] 	https://smart.embl.de/smart/DDvec.cgi?smart=149:SIGNAL(1|19)+ML(24|145)+	2010321M18,2310003O09,2700012J19Rik,67963,AA408070,AAH03471.1,AAH07190.1,AB021289,AK008603,AK009127,AK151067,AK151133,AK153020,AK153203,AK158624,AK165263,AK167869,AK170327,AU045843,BAA35183.1,BAB25771.1,BAB26090.1,BAE30083.1,BAE30141.1,BAE31654.1,BAE31803.1,BAE34585.1,BAE38111.1,BAE39885.1,BAE41721.1,BC003471,BC007190,CCDS26050.1,ENSMUSG00000021242,ENSMUSP00000021668,ENSMUST00000021668,Epididymal secretory protein E1,F430004L15,F630047M22,HE1,I730034P04,I830022H04,I830025L03,I830119C19,I830127F02,K230031K06,MGI:1915213,Mm.282556,NM_023409,NM_023409.4,NPC intracellular cholesterol transporter 2,NPC2,NPC2_MOUSE,NP_075898,NP_075898.1,Niemann Pick type C2 protein homolog,Niemann-Pick C2 protein,Niemann-Pick type C2,Npc2,Npc2-201,Q3UB23,Q9Z0J0,UPI00000018B9,mE1,mmu:67963,uc007oft.1
Nr0b1	10090.ENSMUSP00000026036	Nuclear receptor subfamily 0, group b, member 1; Nuclear receptor subfamily 0 group B member 1; Orphan nuclear receptor. Component of a cascade required for the development of the hypothalamic-pituitary-adrenal-gonadal axis. Acts as a coregulatory protein that inhibits the transcriptional activity of other nuclear receptors through heterodimeric interactions. May also have a role in the development of the embryo and in the maintenance of embryonic stem cell pluripotency (By similarity)	https://smart.embl.de/smart/DDvec.cgi?smart=472:Pfam_NR_Repeat(1|49)+Pfam_NR_Repeat(68|116)+Pfam_NR_Repeat(136|183)+Pfam_NR_Repeat(203|248)+HOLI(258|442)+	11614,3F5C,AAB46875.1,AAC52920.1,AAO47789.1,AHX,AK141239,AY227358,Ahc,Ahch,BAE24608.1,C330034L04,CCDS30260.1,DAX-1,Dax1,EDL29149.1,ENSMUSG00000025056,ENSMUSP00000026036,ENSMUST00000026036,MGI:1352460,Mm.5180,NM_007430,NM_007430.4,NM_007430.5,NP_031456,NP_031456.1,NR0B1,NR0B1_MOUSE,Nr0b1,Nr0b1-001,Nuclear receptor DAX-1,Nuclear receptor subfamily 0 group B member 1,Nuclear receptor subfamily 0, group B, member 1,O09068,O09147,OTTMUSG00000017945,OTTMUSP00000019489,OTTMUST00000043377,Q53ZY9,Q61066,S83178,S83180,U41568,UPI0000006B11,mmu:11614,nuclear receptor subfamily 0, group B, member 1,uc009tsd.1
